Product Name	Company Name
Women Summer Dresses Sleeveless Casual Loose Swing Button Down Midi Sundress with Pockets	MOLERANI
Womens Summer Casual V Neck Sleeveless Mini Dress 2024 Tie Shoulder Tiered Ruffle Swing A Line Short Sundresses	Women Summer Dresses Sleeveless Casual Loose Swing Button Down Midi Sundress with Pockets
Womens Summer Tunic Dress Casual Loose Short Sleeve Crew Neck Flowy Swing Mini Shift Dresses	ZESICA
Women Summer Casual Loose Sleeveless Sundress Spaghetti Strap Flowy Boho Linen Beach Vacation Maxi Long Dress 2024	Womens Summer Casual V Neck Sleeveless Mini Dress 2024 Tie Shoulder Tiered Ruffle Swing A Line Short Sundresses
Casual Dresses for Women Sleeveless Cotton Summer Beach Dress A Line Spaghetti Strap Sundresses with Pockets	Dokotoo
Women Casual Loose Sundress Sleeveless Split Maxi Long Beach Shirt Dress Travel Vacation 2024 Summer Outfits	Womens Summer Tunic Dress Casual Loose Short Sleeve Crew Neck Flowy Swing Mini Shift Dresses
Women Summer Dresses Sleeveless Casual Loose Swing Button Down Midi Dress with Pockets	ANRABESS
Women's Summer Striped Short Sleeve T Shirt Dress Casual Tie Waist with Pockets	Women Summer Casual Loose Sleeveless Sundress Spaghetti Strap Flowy Boho Linen Beach Vacation Maxi Long Dress 2024
Women's 2024 Summer Casual Short Sleeve Crewneck Tiered Flowy Midi Dress Long Hawaiian Beach Sundress	
Women's 2024 Summer Short Puff Sleeve Midi Dress Casual V Neck High Waist Tiered Swing A Line Dresses	YATHON
Womens Summer Casual One Shoulder Midi Dresses 2024 Spring Sleeveless Striped Knit Pleated A Line Flowy Long Dress	Casual Dresses for Women Sleeveless Cotton Summer Beach Dress A Line Spaghetti Strap Sundresses with Pockets
Womens Plus Size Summer Dress Ruffle Cap Sleeve V Neck Swing A Line Cocktail Party Dresses	ANRABESS
	Women Casual Loose Sundress Sleeveless Split Maxi Long Beach Shirt Dress Travel Vacation 2024 Summer Outfits
	MOLERANI
	Women Summer Dresses Sleeveless Casual Loose Swing Button Down Midi Dress with Pockets
	MEROKEETY
	Women's Summer Striped Short Sleeve T Shirt Dress Casual Tie Waist with Pockets
Women's Summer Casual Square Neck Dress with Pocket Cute Sleeveless High Waist A-line Sundress Dresses 2024	STYLEWORD
Womens Sleeveless V Neck Dress with Pocket Summer Beach Midi Flared Tank Dress	Women's 2024 Summer Casual Short Sleeve Crewneck Tiered Flowy Midi Dress Long Hawaiian Beach Sundress
Womens Crewneck Sleeveless Casual Summer Tank Top	MEROKEETY
Women's Summer Flutter Short Sleeve Midi Dress Casual Crewneck Flowy Tiered Beach Dresses	Women's 2024 Summer Short Puff Sleeve Midi Dress Casual V Neck High Waist Tiered Swing A Line Dresses
Womens 2024 Summer V-Neck Drawstring Ruffle Cap Short Sleeve Side Pockets Mini Dress Sundress	ZESICA
Women's Summer Midi Square Neck Dress Cute Floral Flowy A-line Tank Sundresses for Women 2024	Womens Summer Casual One Shoulder Midi Dresses 2024 Spring Sleeveless Striped Knit Pleated A Line Flowy Long Dress
Womens Sundress Summer Floral Short Sleeve Wrap V Neck A-Line Midi Dress	SCOMCHIC
Women's Casual Sleeveless Bodycon Beach Tank Ruched Mini Dresses	Womens Plus Size Summer Dress Ruffle Cap Sleeve V Neck Swing A Line Cocktail Party Dresses
Women's 2024 Summer Floral Boho Dress Square Neck Strapped Swing A Line Beach Long Maxi Dress	
Women Summer Casual Short Sleeve Crewneck Aline Swing Flowy Tiered Shirt Maxi Beach Long Dress 2024 Trendy Outfits	
Womens Square Neck Sleeveless Ruffle Dress High Waist Backless Tiered Smocked Strappy Casual Short Mini Dresses	
Women's 2024 Summer Sleeveless Halter Neck Ruffle Tiered Layed Chiffon Flowy Swing Long Midi Dress	
Women Summer Casual Dress Short Sleeve Crewneck Basic Swing Beach Mini Dresses 2024 Boho Tshirt Short Dress	
Womens Summer Dresses 2024 Short Sleeve V Neck Drawstring Casual Ruffle A-Line Swing Mini Babydoll Dress	
Womens Dresses 2024 Spring Summer Deep V Neck Elegant Bow tie Mini Dress S-XL	
Women's Summer Casual T-Shirt Vacation Dresses	
Womens 2024 Summer V-Neck Drawstring Ruffle Cap Short Sleeve Side Pockets Mini Dress Sundress	
Women 2024 Summer Ruffle Edge Sleeve Dresses Floral Casual Beach Mini Dress with Pocket	
Women's Summer Casual Loose Short Sleeve Long T Shirt Dress Split Maxi Beach Sundress Travel Vacation Outfits	HUHOT
Women's Summer Spaghetti Strap Casual Swing Tank Beach Cover Up Dress with Pockets	Women's Summer Casual Square Neck Dress with Pocket Cute Sleeveless High Waist A-line Sundress Dresses 2024
Womens Summer Ruffle Sleeve V Neck Midi Dress 2024 Fashion Casual Fit Flowy Tiered Boho Beach Vacation Sundress	HUHOT
Womens Summer Tunic Dress Casual Loose Short Sleeve Crew Neck Flowy Swing Mini Shift Dresses	Womens Sleeveless V Neck Dress with Pocket Summer Beach Midi Flared Tank Dress
Women 2024 Summer Sleeveless Tank Dresses Crew Neck Slim Fit Short Casual Ruched Bodycon Party Club Mini Dress	PRETTYGARDEN
Women Summer Casual Loose Sleeveless Sundress Spaghetti Strap Flowy Boho Linen Beach Vacation Maxi Long Dress 2024	Womens Crewneck Sleeveless Casual Summer Tank Top
	MEROKEETY
	Women's Summer Flutter Short Sleeve Midi Dress Casual Crewneck Flowy Tiered Beach Dresses
Women's Summer Sleeveless Striped T Shirt Tank Midi Dress Casual Scoop Neck Bodycon Dresses	Dokotoo
Women's Summer Dresses 2024 Halter Neck Sleeveless Smocked Backless Cut Out Floral Flowy A Line Maxi Dress	Womens 2024 Summer V-Neck Drawstring Ruffle Cap Short Sleeve Side Pockets Mini Dress Sundress
Women's 2024 Summer Casual Flutter Short Sleeve Crew Neck Smocked Elastic Waist Tiered Midi Dress	ZABERRY
Women 2024 Casual Maxi Dress Short Sleeve V Neck Stripe Sundress Split Loose Long Summer Beach T Shirt Dresses	Women's Summer Midi Square Neck Dress Cute Floral Flowy A-line Tank Sundresses for Women 2024
Women's 2024 Summer Short Sleeve Casual Midi Dresses V Neck Floral Sundress Faux Wrap Dress with Pockets	FENSACE
Women Summer Casual Loose Sleeveless Sundress Spaghetti Strap Flowy Boho Linen Beach Vacation Maxi Long Dress 2024	Womens Sundress Summer Floral Short Sleeve Wrap V Neck A-Line Midi Dress
Women's 2024 Halter Neck Floral Summer Casual Sundress	LILLUSORY
Summer Dresses for Women 2024 Sundresses Sleeveless Beach Swimsuit Cover Ups Spring Casual Loose Tank Tshirt Dress	Women's Casual Sleeveless Bodycon Beach Tank Ruched Mini Dresses
Women Summer Casual Sleeveless Crewneck Sundress Aline Flowy Tiered Maxi Long Beach Dress Vacation Outfits	GRACE KARIN
Women's Casual Short Sleeve Wrap Bodycon Ruched Tie Waist Summer Dress	Women's 2024 Summer Floral Boho Dress Square Neck Strapped Swing A Line Beach Long Maxi Dress
Womens 2024 Summer Short Dress V Neck Short Sleeve A Line Hollow Out Lace Ruffle Cute Casual Beach Party Dresses	ANRABESS
Women 2024 Summer Maxi Dress Casual Floral Halter Neck Beach Hawaiian Outfits Wedding Guest Dress	Women Summer Casual Short Sleeve Crewneck Aline Swing Flowy Tiered Shirt Maxi Beach Long Dress 2024 Trendy Outfits
Women’s 2024 Summer Casual Maxi Dress Flutter Sleeve Scoop Neck Smocked Tiered A Line Flowy Beach Long Sun Dresses	Byinns
Women’s 2024 Summer Short Sleeve Crewneck T Shirt Maxi Dress Tie Waist Casual Slim Fit Slit Long Beach Dresses	Womens Square Neck Sleeveless Ruffle Dress High Waist Backless Tiered Smocked Strappy Casual Short Mini Dresses
Women 2024 Summer Sleeveless Tank Dresses Crew Neck Slim Fit Short Casual Ruched Bodycon Party Club Mini Dress	ZESICA
Womens Wrap V Neck Sleeveless Sundress Summer Flare Tank Dress with Pockets …	Women's 2024 Summer Sleeveless Halter Neck Ruffle Tiered Layed Chiffon Flowy Swing Long Midi Dress
Women Sleeveless Summer Dress 2024 Crewneck Ribbed Knit Ruffle Swing Button Down Beach Sun Mini Tank Short Dresses	ANRABESS
Womens Casual Sleeveless Strap Loose Adjustable Jumpsuits Stretchy Long Pants Romper with Pockets	Women Summer Casual Dress Short Sleeve Crewneck Basic Swing Beach Mini Dresses 2024 Boho Tshirt Short Dress
Womens Summer Wrap Maxi Dress Casual Boho Floral V Neck Short Sleeve Ruffle Hem Split Beach Long Dresses	Dokotoo
Womens Summer Dress Lantern Sleeve Square Neck Tie Back Flowy A-Line Double Layer Hem Mini Dress	Womens Summer Dresses 2024 Short Sleeve V Neck Drawstring Casual Ruffle A-Line Swing Mini Babydoll Dress
Womens Summer Dresses Beach Casual Loose Tshirt Floral Short Sleeve Flowy Pockets Sundresses	Dokotoo
Women's 2024 Summer Boho Spaghetti Strap Square Neck Solid Color Ruffle A Line Beach Long Maxi Dress	Womens Dresses 2024 Spring Summer Deep V Neck Elegant Bow tie Mini Dress S-XL
Women's Ruffle Hem Sleeveless Tank Dress Round Neck Casual Smock Summer Mini Dresses	MOLERANI
Summer Dresses for Women 2024 Trendy Boho Floral Print Beach Cover Up Casual Spring Sleeveless Sundresses	Women's Summer Casual T-Shirt Vacation Dresses
Summer Dresses for Women V Neck Cap Sleeve Ruffle Hem Smock Short Dress	Dokotoo
Womens Summer Sleeveless Striped T Shirt Dress Casual Crew Neck Tie Waist Mini Dresses	Womens 2024 Summer V-Neck Drawstring Ruffle Cap Short Sleeve Side Pockets Mini Dress Sundress
Women's 2024 Summer Boho Floral Print Square Neck Ruffle Swing Beach Long Maxi Dress	Dokotoo
Women Summer Dresses Sleeveless Casual Loose Swing Button Down Midi Dress with Pockets	Women 2024 Summer Ruffle Edge Sleeve Dresses Floral Casual Beach Mini Dress with Pocket
Womens Summer Spaghetti Strap Sleeveless High Waist Beach Long Maxi Sun Dress	ANRABESS
Womens Summer Casual Sleeveless Square Neck Smocked Ruffle Backless Boho Mini Dress 2024 Trendy Short Sundress	Women's Summer Casual Loose Short Sleeve Long T Shirt Dress Split Maxi Beach Sundress Travel Vacation Outfits
Women's Summer Short Sleeve Casual Dresses V-Neck Floral Party Dress with Pockets	MISFAY
Womens White Dresses Short Sleeve V Neck Ruffle Cute Sun Dress Chiffon Flowy Shift Mini Dress	Women's Summer Spaghetti Strap Casual Swing Tank Beach Cover Up Dress with Pockets
Womens Summer Dresses 2024 Short Sleeve V Neck Drawstring Casual Ruffle A-Line Swing Mini Babydoll Dress	ANRABESS
Women's Summer Dress Square Neck Short Sleeves Crossover Waist Casual Party Mini Dress	Womens Summer Ruffle Sleeve V Neck Midi Dress 2024 Fashion Casual Fit Flowy Tiered Boho Beach Vacation Sundress
	Dokotoo
	Womens Summer Tunic Dress Casual Loose Short Sleeve Crew Neck Flowy Swing Mini Shift Dresses
